{"version":2,"scope":"aaaaaaaaaaaaaaaaaaaaaaaaaaaaaaaaaaaaaaaaaaaaaaaaaaaaaaaaaaaaaaaa","bucket":"codex","window_minutes":10080,"observed_at":1789248000,"updated_at":1789248000,"as_of":1789248000,"age_seconds":0,"stale_after_seconds":180,"status":"ok","reason":null,"source_error":null,"remaining_percent":55,"reset_at":1789849200,"reset_local":"2026-09-19 13:20 -07:00","timezone":"America/Los_Angeles","cycle":{"start_at":1789244400,"end_at":1789849200,"state":"observed"},"days":[{"start_at":1789244400,"end_at":1789282800,"label":"Sa","used_delta_pp":3,"coverage":"partial"},{"start_at":1789282800,"end_at":1789369200,"label":"Su","used_delta_pp":0,"coverage":"future"},{"start_at":1789369200,"end_at":1789455600,"label":"M","used_delta_pp":0,"coverage":"future"},{"start_at":1789455600,"end_at":1789542000,"label":"T","used_delta_pp":0,"coverage":"future"},{"start_at":1789542000,"end_at":1789628400,"label":"W","used_delta_pp":0,"coverage":"future"},{"start_at":1789628400,"end_at":1789714800,"label":"Th","used_delta_pp":0,"coverage":"future"},{"start_at":1789714800,"end_at":1789801200,"label":"F","used_delta_pp":0,"coverage":"future"},{"start_at":1789801200,"end_at":1789849200,"label":"Sa","used_delta_pp":0,"coverage":"future"}],"resets_available":3}
