{"version":2,"scope":null,"bucket":"codex","window_minutes":10080,"observed_at":null,"updated_at":null,"as_of":1788940800,"age_seconds":null,"stale_after_seconds":180,"status":"unavailable","reason":"no_observation","source_error":null,"remaining_percent":null,"reset_at":null,"reset_local":null,"timezone":"America/Los_Angeles","cycle":{"start_at":null,"end_at":null,"state":"unknown"},"days":[],"resets_available":null}
