{"version":2,"scope":"aaaaaaaaaaaaaaaaaaaaaaaaaaaaaaaaaaaaaaaaaaaaaaaaaaaaaaaaaaaaaaaa","bucket":"codex","window_minutes":10080,"observed_at":1788940800,"updated_at":1788940800,"as_of":1789545600,"age_seconds":604800,"stale_after_seconds":180,"status":"stale","reason":"reset_due","source_error":null,"remaining_percent":55,"reset_at":1789369200,"reset_local":"2026-09-14 00:00 -07:00","timezone":"America/Los_Angeles","cycle":{"start_at":1788764400,"end_at":1789369200,"state":"observed"},"days":[{"start_at":1788764400,"end_at":1788850800,"label":"M","used_delta_pp":30,"coverage":"complete"},{"start_at":1788850800,"end_at":1788937200,"label":"T","used_delta_pp":15,"coverage":"partial"},{"start_at":1788937200,"end_at":1789023600,"label":"W","used_delta_pp":0,"coverage":"partial"},{"start_at":1789023600,"end_at":1789110000,"label":"Th","used_delta_pp":null,"coverage":"unknown"},{"start_at":1789110000,"end_at":1789196400,"label":"F","used_delta_pp":null,"coverage":"unknown"},{"start_at":1789196400,"end_at":1789282800,"label":"Sa","used_delta_pp":null,"coverage":"unknown"},{"start_at":1789282800,"end_at":1789369200,"label":"Su","used_delta_pp":null,"coverage":"unknown"}],"resets_available":3}
